Event Name,Description,Date,Venue
Hackotan,A 24-hour hackathon where coders compete to solve real-world problems.,2025-04-10,Tech Auditorium
Concert,A live musical concert featuring popular bands and solo artists.,2025-04-15,Main Stage
Jamming Session,An open mic event for musicians to showcase their talent.,2025-04-18,Music Hall
MUN,Model United Nations conference for debating global issues.,2025-04-22,Conference Room A
Esport,An esports tournament featuring competitive gaming matches.,2025-04-25,Gaming Arena
